{
  "uid": "api-internal-operations",
  "status": "requested",
  "name": "Internal Operations API",
  "description": "Build custom business logic, operations and workflows under a single api. Execute sinple to complex operations, such as sending emails, provisioning users, provisioning infrastructure, and much more via your webhooks and API calls from anywhere.",
  "labels": [
    "department:operations",
    "api:mongodb",
    "category:api",
    "type:operations",
    "type:productivity"
  ],
  "display": {
    "avatar": "https://netzo.io/images/home/apis.svg"
  },
  "links": [
    {
      "rel": "repository",
      "href": "https://github.com/netzo/netzo/tree/main/templates/_requested/api-internal-operations"
    }
  ]
}
