{
  "uid": "daisyui",
  "status": "published",
  "name": "DaisyUI",
  "description": "A CSS only basic starter template using the DaisyUI library",
  "labels": [
    "css",
    "daisyui"
  ],
  "display": {
    "avatar": "https://api.iconify.design/mdi:language-css3.svg?color=%232965f1"
  },
  "links": [
    {
      "rel": "repository",
      "href": "https://github.com/netzo/netzo/tree/main/templates/daisyui"
    },
    {
      "rel": "readme",
      "href": "https://raw.githubusercontent.com/netzo/netzo/main/templates/daisyui/src/readme.md"
    }
  ],
  "item": {
    "_type": "project",
    "uid": "daisyui",
    "fs": {
      "readme.md": {
        "url": "https://raw.githubusercontent.com/netzo/netzo/main/templates/daisyui/src/readme.md"
      },
      "main.tsx": {
        "url": "https://raw.githubusercontent.com/netzo/netzo/main/templates/daisyui/src/main.tsx"
      }
    },
    "configuration": {
      "entrypoint": "main.tsx",
      "envs": {},
      "permissions": {
        "net": true
      }
    }
  }
}
