{
  "uid": "app-nps-sales-customer-support",
  "status": "requested",
  "name": "NPS for Sales and Support",
  "description": "A dashboard for visualizing and analyzing Net Promoter Score (NPS) data for sales and customer support representatives.",
  "labels": [
    "department:sales",
    "department:customer-support",
    "category:app"
  ],
  "display": {
    "avatar": "https://netzo.io/images/home/bi-dashboards.svg"
  },
  "links": [
    {
      "rel": "repository",
      "href": "https://github.com/netzo/netzo/tree/main/templates/_requested/app-nps-sales-customer-support"
    }
  ]
}