{
  "uid": "app-know-your-customer-dashboard",
  "status": "requested",
  "name": "Know-Your-Customer Dashboard",
  "description": "Consolidate customer data from any SaaS API, database or spreadsheet for a holistic view of the customer. Enhance team productivity with all the required informationn in one place, while protecting sensitive data from unauthorized individuals.",
  "labels": [
    "department:operations",
    "department:sales",
    "api:googlesheets",
    "api:pipedrive",
    "api:stripe",
    "type:compliance",
    "category:app"
  ],
  "display": {
    "avatar": "https://raw.githubusercontent.com/netzo/netzo/main/templates/_requested/app-know-your-customer-dashboard/icon.svg"
  },
  "links": [
    {
      "rel": "repository",
      "href": "https://github.com/netzo/netzo/tree/main/templates/_requested/app-know-your-customer-dashboard"
    }
  ]
}
