{
  "uid": "workflow-file-upload-router",
  "status": "requested",
  "name": "File Upload Router for Drive",
  "description": "A file upload portal that automatically names files with a defined naming convention, logs activity in Google Sheets and stores them in the corresponding locations in Google Drive. This app streamlines file management, handling, searching and retrieval.",
  "labels": [
    "department:operations",
    "api:googlesheets",
    "api:googledrive",
    "usecase:workflow"
  ],
  "display": {
    "avatar": "https://netzo.io/images/home/workflows.svg"
  },
  "links": [
    {
      "rel": "repository",
      "href": "https://github.com/netzo/netzo/tree/main/templates/_requested/workflow-file-upload-router"
    }
  ]
}