{
  "uid": "app-executive-company-overview",
  "status": "requested",
  "name": "Executive Data Visualization Dashboard",
  "description": "Consolidate, cross-check and display data from all departments in a single real-time view for executives. Take snapshots, automate reporting and share with stakeholders, live, on-print or email.",
  "labels": [
    "category:apps",
    "type:",
    "type:data analysis",
    "department:marketing",
    "department:sales"
  ],
  "display": {
    "avatar": "https://netzo.io/images/home/bi-dashboards.svg"
  },
  "links": [
    {
      "rel": "repository",
      "href": "https://github.com/netzo/netzo/tree/main/templates/_requested/app-executive-company-overview"
    }
  ]
}