{
  "uid": "dashboard-progress-tracker-github",
  "status": "requested",
  "name": "Progress Tracker for GitHub",
  "description": "A progress tracking tool for non-technical departments to keep track of development cycles such as upcomming features, bug fixes, versions and issues on GitHub.",
  "labels": [
    "department:engineering",
    "department:product",
    "department:marketing",
    "department:sales",
    "resources:github",
    "usecase:dashboard",
    "usecase:communication/email",
    "usecase:productivity"
  ],
  "display": {
    "avatar": "https://netzo.io/images/home/bi-dashboards.svg"
  },
  "links": [
    {
      "rel": "repository",
      "href": "https://github.com/netzo/netzo/tree/main/templates/_requested/dashboard-progress-tracker-github"
    }
  ]
}
