{
  "uid": "app-inventory-management-ecommerce",
  "status": "requested",
  "name": "E-Commerce Inventory Management",
  "description": "A personalized administration panel to perform manual actions, override or extend e-commerce functionality, and manage inventory. Operations teams can use this to manage their e-commerce sites with advanced control tailored to their needs.",
  "labels": [
    "department:sales",
    "department:operations",
    "category:app",
    "type:productivity"
  ],
  "display": {
    "avatar": "https://netzo.io/images/home/admin-panels.svg"
  },
  "links": [
    {
      "rel": "repository",
      "href": "https://github.com/netzo/netzo/tree/main/templates/_requested/app-inventory-management-ecommerce"
    }
  ]
}