{
  "uid": "app-custom-crm-mongodb",
  "status": "requested",
  "name": "Custom CRM on MongoDB",
  "description": "An adaptable CRM solution designed to cater to the unique requirements of your marketing or sales team with a customizable API interface endpoints for advanced functionality, prospecting and AI integration.",
  "labels": [
    "department:sales",
    "department:marketing",
    "api:mongodb",
    "category:app",
    "type:productivity"
  ],
  "display": {
    "avatar": "https://raw.githubusercontent.com/netzo/netzo/main/www/src/public/use-cases/app-custom-crm-mongodb/icon.svg"
  },
  "links": [
    {
      "rel": "repository",
      "href": "https://github.com/netzo/netzo/tree/main/templates/_requested/app-custom-crm-mongodb"
    }
  ]
}
